Position,Project Name,Project Image
1,Al Raha Beach,https://aecom.com/wp-content/uploads/2017/01/Al_Raha_Beach_201401-19_Approved-by-Client_OPP-10762.jpg
2,"Geelong Civic Precinct, City of Greater Geelong, Victoria Australia",https://aecom.com/wp-content/uploads/2020/07/191010-Mercer-St-SE-1.jpg
3,Montreal University Hospital Center (CHUM),https://aecom.com/wp-content/uploads/2016/08/CHUM_Montreal_University_Hospital_Center_mainimg-1.jpg
4,Croton Water Treatment Plant,https://aecom.com/wp-content/uploads/2013/11/WW_Croton.jpg
5,"Wesley Place, 130 Lonsdale Street",https://aecom.com/wp-content/uploads/2021/03/wesley-130-lonsdale-3-e1616579649428.jpg
6,Adaptation Planning for Sea Level Rise at Australian Defence Sites,https://aecom.com/wp-content/uploads/2015/11/adaptation_planning_australian_defence-e1447777681787.jpg
7,NYC Bus Rapid Transit,https://aecom.com/wp-content/uploads/2024/03/NYCBus_Project_Hero.jpg
8,Ashlu Hydroelectric Project,https://aecom.com/wp-content/uploads/2016/08/Ashlu_Hydroelectric_main_img.jpg
9,Masdar City,https://aecom.com/wp-content/uploads/2017/01/MAsdar-Inst-photo.2.jpg
10,San Diego International Airport Green Build,https://aecom.com/wp-content/uploads/2023/03/San-Diego-International-Airport-header.png
